{
  "meta": {
    "snapshotDate": "2026-08-26",
    "version": "0.3",
    "note": "Relative influence estimates for visualization only — not precise market shares. D+1 after Gemini Enterprise Legal & FS launch."
  },
  "players": {
    "google":     { "id": "google",     "name": "Google",               "short": "G",   "hex": "#4285F4", "role": "Hyperscaler – Industry Solutions",   "momentum": "up" },
    "microsoft":  { "id": "microsoft",  "name": "Microsoft",            "short": "MS",  "hex": "#F25022", "role": "Hyperscaler – Copilot Ecosystem",   "momentum": "stable" },
    "anthropic":  { "id": "anthropic",  "name": "Anthropic",            "short": "A",   "hex": "#C15F3C", "role": "Foundation Lab – Enterprise LLM",  "momentum": "up" },
    "openai":     { "id": "openai",     "name": "OpenAI",               "short": "OAI", "hex": "#10A37F", "role": "Foundation Lab",                    "momentum": "down" },
    "aws":        { "id": "aws",        "name": "AWS",                  "short": "AWS", "hex": "#FF9900", "role": "Hyperscaler – Bedrock",             "momentum": "stable" },
    "specialist": { "id": "specialist", "name": "Vertical Specialists", "short": "VS",  "hex": "#A855F7", "role": "Harvey, Healthcare AI etc.",        "momentum": "up" },
    "ibm":        { "id": "ibm",        "name": "IBM / Governance",     "short": "IBM", "hex": "#0F62FE", "role": "Governance-first",                  "momentum": "stable" }
  },
  "territories": [
    {
      "id": "legal",
      "name": "Legal",
      "meta": "Contracts • Research • Compliance",
      "status": "hot",
      "influence": { "google": 31, "microsoft": 31, "specialist": 26, "anthropic": 9, "openai": 3 },
      "note": "D+1: Google closes the gap with Microsoft after Gemini Enterprise for Legal preview. Harvey / specialists still strong on pure legal workflows."
    },
    {
      "id": "finance",
      "name": "Financial Services",
      "meta": "Capital Markets • KYC • Risk",
      "status": "hot",
      "influence": { "google": 33, "microsoft": 34, "anthropic": 12, "openai": 9, "aws": 7, "specialist": 5 },
      "note": "Google pressure rises post-launch. Microsoft still leads on installed base; contest tightens."
    },
    {
      "id": "healthcare",
      "name": "Healthcare",
      "meta": "EHR • Documentation • Prior Auth",
      "status": "hot",
      "influence": { "microsoft": 29, "specialist": 28, "google": 18, "anthropic": 12, "openai": 9, "ibm": 4 },
      "note": "Elevated to HOT: market anticipates Google Healthcare move; specialists and Microsoft already dense."
    },
    {
      "id": "lifesci",
      "name": "Life Sciences",
      "meta": "GxP • R&D • Regulatory",
      "status": "contested",
      "influence": { "google": 20, "microsoft": 24, "specialist": 22, "anthropic": 15, "ibm": 12, "openai": 7 },
      "note": "Google horizon signal increases relative positioning. Governance needs still favor controlled platforms."
    },
    {
      "id": "insurance",
      "name": "Insurance",
      "meta": "Underwriting • Claims • Compliance",
      "status": "normal",
      "influence": { "microsoft": 35, "google": 16, "anthropic": 12, "aws": 12, "openai": 9, "specialist": 16 },
      "note": "Microsoft strong via existing enterprise footprint. Slow movement."
    },
    {
      "id": "gov",
      "name": "Government",
      "meta": "Case Mgmt • Security • Citizens",
      "status": "normal",
      "influence": { "microsoft": 40, "google": 19, "ibm": 15, "aws": 11, "anthropic": 10, "openai": 5 },
      "note": "Long cycles, high trust. Slight Google uptick; structure unchanged."
    },
    {
      "id": "profsvcs",
      "name": "Professional Services",
      "meta": "Consulting • Audit • Tax",
      "status": "contested",
      "influence": { "microsoft": 37, "google": 22, "anthropic": 15, "openai": 11, "specialist": 10, "aws": 5 },
      "note": "Google gains on playbook-adjacent work. Microsoft Copilot still primary distribution."
    },
    {
      "id": "retail",
      "name": "Retail",
      "meta": "Customer Data • Supply • Compliance",
      "status": "normal",
      "influence": { "google": 26, "microsoft": 29, "aws": 20, "openai": 10, "anthropic": 8, "specialist": 7 },
      "note": "Still on Google roadmap. Early positioning drift only."
    }
  ],
  "geoDominance": {
    "na": { "dominant": "microsoft", "intensity": 0.83, "note": "Microsoft still densest in NA, but Google Legal/FS launch compresses the gap. Intensity slightly down as contest rises." },
    "sa": { "dominant": "microsoft", "intensity": 0.55, "note": "Microsoft still leads; lower overall enterprise AI maturity." },
    "eu": { "dominant": "microsoft", "intensity": 0.68, "note": "Microsoft footprint remains; Google regulated push and Anthropic safety deals keep EU contested." },
    "af": { "dominant": "microsoft", "intensity": 0.40, "note": "Emerging. Microsoft and Google competing for public sector and banking." },
    "as": { "dominant": "google",    "intensity": 0.67, "note": "Google Cloud strong in APAC; slight intensity rise after industry-solution narrative." },
    "oc": { "dominant": "microsoft", "intensity": 0.60, "note": "Microsoft dominant in Australia/NZ. Google increasing presence." }
  },
  "events": [
    { "time": "2026-08-26", "text": "D+1 snapshot: Google closes Legal gap with Microsoft; Healthcare elevated to HOT as market prices next vertical." },
    { "time": "2026-08-25", "text": "Google launches Gemini Enterprise for Legal + Financial Services. Roadmap: Healthcare, Life Sciences, Retail." },
    { "time": "2026-08-25", "text": "Menlo Ventures (late 2025): Anthropic ~40% enterprise LLM spend, OpenAI ~27%, Google ~21%." },
    { "time": "2026-Q2",    "text": "Microsoft continues strong horizontal distribution via M365 Copilot in regulated industries." }
  ],
  "pipeline": [
    "Healthcare (Google) — now priced as near-term",
    "Life Sciences (Google)",
    "Retail (Google)",
    "More Prof. Services",
    "Insurance depth",
    "Gov vertical agents"
  ]
}
